<?xml version="1.0" encoding="UTF-8" ?>

<p7:SteelArm xmlns:xsi="http://www.w3.org/2001/XMLSchema-instance"
       xmlns:p7="http://nure.ua/matchenko/practice7"
    xsi:schemaLocation="http://nure.ua/matchenko/practice7 input.xsd">
    <Knife>
        <Type>knife</Type>
        <Handy>one-handed</Handy>
        <Origin>Sweden</Origin>
        <Visual>
            <Blade>
                <Length>10</Length>
                <Width>12</Width>
            </Blade>
            <Material>
                <BladeMaterial>steel</BladeMaterial>
                <WoodHandle>wooden</WoodHandle>
                <WoodType>oak</WoodType>
            </Material>
            <Bloodstream>true</Bloodstream>
        </Visual>
        <Visual>
            <Blade>
                <Length>17</Length>
                <Width>16</Width>
            </Blade>
            <Material>
                <BladeMaterial>iron</BladeMaterial>
                <Handle>onion</Handle>
            </Material>
            <Bloodstream>false</Bloodstream>
        </Visual>
        <Value>true</Value>
    </Knife>

    <Knife>
        <Type>dagger</Type>
        <Handy>one-handed</Handy>
        <Origin>USA</Origin>
        <Visual>
            <Blade>
                <Length>15</Length>
                <Width>18</Width>
            </Blade>
            <Material>
                <BladeMaterial>cast iron</BladeMaterial>
                <Handle>plastic</Handle>
            </Material>
            <Bloodstream>false</Bloodstream>
        </Visual>
        <Visual>
            <Blade>
                <Length>18</Length>
                <Width>17</Width>
            </Blade>
            <Material>
                <BladeMaterial>wooden</BladeMaterial>
                <WoodHandle>wooden</WoodHandle>
                <WoodType>tree</WoodType>
            </Material>
            <Bloodstream>false</Bloodstream>
        </Visual>
        <Value>false</Value>
    </Knife>

    <Knife>
        <Type>saber</Type>
        <Handy>two-handed</Handy>
        <Origin>France</Origin>
        <Visual>
            <Blade>
                <Length>25</Length>
                <Width>20</Width>
            </Blade>
            <Material>
                <BladeMaterial>copper</BladeMaterial>
                <WoodHandle>wooden</WoodHandle>
                <WoodType>pine</WoodType>
            </Material>
            <Bloodstream>false</Bloodstream>
        </Visual>
        <Visual>
            <Blade>
                <Length>10</Length>
                <Width>12</Width>
            </Blade>
            <Material>
                <BladeMaterial>steel</BladeMaterial>
                <WoodHandle>wooden</WoodHandle>
                <WoodType>oak</WoodType>
            </Material>
            <Bloodstream>true</Bloodstream>
        </Visual>
        <Visual>
            <Blade>
                <Length>15</Length>
                <Width>18</Width>
            </Blade>
            <Material>
                <BladeMaterial>cast iron</BladeMaterial>
                <Handle>plastic</Handle>
            </Material>
            <Bloodstream>false</Bloodstream>
        </Visual>
        <Value>true</Value>
    </Knife>

</p7:SteelArm>